{"environment":"sandbox","appBundleID":"OllyJ.My-Train-Times","tokenUpdatedAt":"2026-10-02T02:46:45Z","lineID":"liberty","stationID":"910GROMFORD","selectionMode":"allPlatforms","activityID":"synthetic-capability2","activityStartedAt":"2026-10-02T02:46:45Z","installID":"89FA6678-1E2D-4D99-9816-40F5EE88D724","buildNumber":"unknown","pushTokenHex":"aaaaaaaaaaaaaaaaaaaaaaaaaaaaaaaaaaaaaaaaaaaaaaaaaaaaaaaaaaaaaaaa","activityEndsAt":"2026-10-02T02:56:45Z","appVersion":"unknown"}